{
  "schemaVersion": 2,
  "packId": "home-return-foundation",
  "version": 2,
  "title": "Four-day dumbbell training",
  "createdOn": "2026-10-25",
  "language": "en-US",
  "units": "kg",
  "description": "Four fixed home sessions with structured warm-up, workout and cooldown activities. Loads are selected and changed by the user; no staged progression blocks.",
  "assumptions": [
    "Dumbbells, a stable flat bench or seat, floor space and a wall or fixed support.",
    "No adjustable bench, barbell, squat rack, cable machine or step platform is required.",
    "Use only comfortable controlled movements and loads that can be positioned safely."
  ],
  "videos": [
    {
      "id": "v-bench",
      "provider": "youtube",
      "youtubeId": "622ku8i0M14",
      "url": "https://www.youtube.com/watch?v=622ku8i0M14",
      "title": "My Tricks: Dumbbell Bench Press",
      "channel": "ScottHermanFitness",
      "checkedOn": "2026-10-25",
      "verification": "search_metadata_matched",
      "playbackVerified": false,
      "embeddingVerified": false,
      "usageNote": "Exact exercise tutorial; use this pack for sets, reps and effort."
    },
    {
      "id": "v-floor",
      "provider": "youtube",
      "youtubeId": "T0Y3OBF1bNI",
      "url": "https://www.youtube.com/watch?v=T0Y3OBF1bNI",
      "title": "How To Do A Dumbbell Floor Press",
      "channel": "PureGym",
      "checkedOn": "2026-10-25",
      "verification": "playback_checked",
      "playbackVerified": true,
      "embeddingVerified": true,
      "usageNote": "Exact exercise tutorial; use this pack for sets, reps and effort."
    },
    {
      "id": "v-incline-pushup",
      "provider": "youtube",
      "youtubeId": "0JUrOH--Kdk",
      "url": "https://www.youtube.com/watch?v=0JUrOH--Kdk",
      "title": "How to do an Incline Push-Up | Proper Form & Technique | NASM",
      "channel": "National Academy of Sports Medicine (NASM)",
      "checkedOn": "2026-10-25",
      "verification": "search_metadata_matched",
      "playbackVerified": false,
      "embeddingVerified": false,
      "usageNote": "Exact exercise tutorial; use this pack for sets, reps and effort."
    },
    {
      "id": "v-row",
      "provider": "youtube",
      "youtubeId": "pYcpY20QaE8",
      "url": "https://www.youtube.com/watch?v=pYcpY20QaE8",
      "title": "How To: Dumbbell Bent-Over Row (Single-Arm)",
      "channel": "ScottHermanFitness",
      "checkedOn": "2026-10-25",
      "verification": "playback_checked",
      "playbackVerified": true,
      "embeddingVerified": true,
      "usageNote": "Exact exercise tutorial; use this pack for sets, reps and effort."
    },
    {
      "id": "v-reverse-fly",
      "provider": "youtube",
      "youtubeId": "evXOlgLTPCw",
      "url": "https://www.youtube.com/watch?v=evXOlgLTPCw",
      "title": "Bent Over Dumbbell Reverse Fly",
      "channel": "daniellagimodierept",
      "checkedOn": "2026-10-25",
      "verification": "search_metadata_matched",
      "playbackVerified": false,
      "embeddingVerified": false,
      "usageNote": "Exact exercise tutorial; use this pack for sets, reps and effort."
    },
    {
      "id": "v-shrug",
      "provider": "youtube",
      "youtubeId": "cJRVVxmytaM",
      "url": "https://www.youtube.com/watch?v=cJRVVxmytaM",
      "title": "How To: Dumbbell Shrugs",
      "channel": "ScottHermanFitness",
      "checkedOn": "2026-10-25",
      "verification": "search_metadata_matched",
      "playbackVerified": false,
      "embeddingVerified": false,
      "usageNote": "Exact exercise tutorial; use this pack for sets, reps and effort."
    },
    {
      "id": "v-squat",
      "provider": "youtube",
      "youtubeId": "9KzZD_n2r64",
      "url": "https://www.youtube.com/watch?v=9KzZD_n2r64",
      "title": "How to Goblet Squat - The Complete Guide for Beginners",
      "channel": "Naomi Kong",
      "checkedOn": "2026-10-25",
      "verification": "playback_checked",
      "playbackVerified": true,
      "embeddingVerified": true,
      "usageNote": "Exact exercise tutorial; use this pack for sets, reps and effort."
    },
    {
      "id": "v-rdl",
      "provider": "youtube",
      "youtubeId": "ndfZi5fDaVM",
      "url": "https://www.youtube.com/watch?v=ndfZi5fDaVM",
      "title": "Dumbbell RDL | Romanian Deadlift Tutorial",
      "channel": "Lift With Michelle - Exercise Form Tutorials",
      "checkedOn": "2026-10-25",
      "verification": "playback_checked",
      "playbackVerified": true,
      "embeddingVerified": true,
      "usageNote": "Exact exercise tutorial; use this pack for sets, reps and effort."
    },
    {
      "id": "v-lunge",
      "provider": "youtube",
      "youtubeId": "C_P3Q-PssvY",
      "url": "https://www.youtube.com/watch?v=C_P3Q-PssvY",
      "title": "How To Do A Reverse Lunge | The Right Way | Well+Good",
      "channel": "Well+Good",
      "checkedOn": "2026-10-25",
      "verification": "search_metadata_matched",
      "playbackVerified": false,
      "embeddingVerified": false,
      "usageNote": "Reverse-lunge technique; start with bodyweight and a stable hand support, then add load only when balanced."
    },
    {
      "id": "v-calf",
      "provider": "youtube",
      "youtubeId": "mD-HtAMNM7c",
      "url": "https://www.youtube.com/watch?v=mD-HtAMNM7c",
      "title": "A1 | Calf Raises (Floor)",
      "channel": "Physio REHAB",
      "checkedOn": "2026-10-25",
      "verification": "search_metadata_matched",
      "playbackVerified": false,
      "embeddingVerified": false,
      "usageNote": "Floor calf-raise demonstration replacing the previously private link. The plan sets all training targets. Playback and embed availability require a browser check."
    },
    {
      "id": "v-press",
      "provider": "youtube",
      "youtubeId": "wO0l5jW2NtQ",
      "url": "https://www.youtube.com/watch?v=wO0l5jW2NtQ",
      "title": "How to do a Standing Dumbbell Shoulder Press!",
      "channel": "Elite Performance",
      "checkedOn": "2026-10-25",
      "verification": "search_metadata_matched",
      "playbackVerified": false,
      "embeddingVerified": false,
      "usageNote": "Exact exercise tutorial; use this pack for sets, reps and effort."
    },
    {
      "id": "v-lateral",
      "provider": "youtube",
      "youtubeId": "PzsMitRdI_8",
      "url": "https://www.youtube.com/watch?v=PzsMitRdI_8",
      "title": "How to do the DUMBBELL LATERAL RAISE! | 2 Minute Tutorial",
      "channel": "Max Euceda",
      "checkedOn": "2026-10-25",
      "verification": "playback_checked",
      "playbackVerified": true,
      "embeddingVerified": true,
      "usageNote": "Exact exercise tutorial; use this pack for sets, reps and effort."
    },
    {
      "id": "v-curl",
      "provider": "youtube",
      "youtubeId": "in7PaeYlhrM",
      "url": "https://www.youtube.com/watch?v=in7PaeYlhrM",
      "title": "The ONLY Way You Should Be Doing Dumbbell Bicep Curls!",
      "channel": "Mind Pump TV",
      "checkedOn": "2026-10-25",
      "verification": "playback_checked",
      "playbackVerified": true,
      "embeddingVerified": true,
      "usageNote": "Technique reference; the title is the creator's wording, not a claim that only one curl technique is valid."
    },
    {
      "id": "v-hammer",
      "provider": "youtube",
      "youtubeId": "BRVDS6HVR9Q",
      "url": "https://www.youtube.com/watch?v=BRVDS6HVR9Q",
      "title": "How To Perform HAMMER CURLS | Biceps Exercise Tutorial",
      "channel": "Buff Dudes Workouts",
      "checkedOn": "2026-10-25",
      "verification": "search_metadata_matched",
      "playbackVerified": false,
      "embeddingVerified": false,
      "usageNote": "Exact exercise tutorial; use this pack for sets, reps and effort."
    },
    {
      "id": "v-triceps",
      "provider": "youtube",
      "youtubeId": "m58XEsPojZU",
      "url": "https://www.youtube.com/watch?v=m58XEsPojZU",
      "title": "Dumbbell Triceps Extension on Floor",
      "channel": "Ames Elite Fitness",
      "checkedOn": "2026-10-25",
      "verification": "search_metadata_matched",
      "playbackVerified": false,
      "embeddingVerified": false,
      "usageNote": "Exact exercise tutorial; use this pack for sets, reps and effort."
    },
    {
      "id": "v-close-floor",
      "provider": "youtube",
      "youtubeId": "AOGkkhMhebQ",
      "url": "https://www.youtube.com/watch?v=AOGkkhMhebQ",
      "title": "Close-Grip Dumbbell Chest Press (On The Floor) (Tutorial + Tips) | Team Evolve",
      "channel": "Vivian Ngo",
      "checkedOn": "2026-10-25",
      "verification": "search_metadata_matched",
      "playbackVerified": false,
      "embeddingVerified": false,
      "usageNote": "Exact exercise tutorial; use this pack for sets, reps and effort."
    },
    {
      "id": "v-deadbug",
      "provider": "youtube",
      "youtubeId": "BZYaCzbP09M",
      "url": "https://www.youtube.com/watch?v=BZYaCzbP09M",
      "title": "Dead Bug",
      "channel": "E3 Rehab Exercise Library",
      "checkedOn": "2026-10-25",
      "verification": "playback_checked",
      "playbackVerified": true,
      "embeddingVerified": true,
      "usageNote": "Exact exercise tutorial; use this pack for sets, reps and effort."
    },
    {
      "id": "v-sideplank",
      "provider": "youtube",
      "youtubeId": "ZpBJIRLGEgg",
      "url": "https://www.youtube.com/watch?v=ZpBJIRLGEgg",
      "title": "How to do a Side Plank",
      "channel": "National Academy of Sports Medicine (NASM)",
      "checkedOn": "2026-10-25",
      "verification": "playback_checked",
      "playbackVerified": true,
      "embeddingVerified": true,
      "usageNote": "Side-plank technique. Start with bent knees if the straight-leg version is too difficult."
    },
    {
      "id": "v-bridge",
      "provider": "youtube",
      "youtubeId": "SKOMwg1JLrU",
      "url": "https://www.youtube.com/watch?v=SKOMwg1JLrU",
      "title": "How to do a Glute bridge",